{
  "schema_version": 1,
  "message_id": "01950000-0000-7000-8000-000000002004",
  "correlation_id": "run:01950000-0000-7000-8000-000000000101",
  "sent_at": "2026-03-09T12:00:00Z",
  "type": "upload_artifact",
  "run_id": "01950000-0000-7000-8000-000000000101",
  "name": "notes.md",
  "media_type": "text/markdown",
  "size": 45,
  "sha256": "58b6bd5012768a6b890e6167b72b0b9a6629e9dbcbb7f93b8c47b13208b8ba36",
  "content": "# Notes\n\nThe March invoice is ready to send.\n"
}
